"x128411498","x1206763901691424769",2019-12-17 02:31:49,"MenziesResearch","The 2019 Christmas edition of the Healthy Tomorrow newsletter is out now. It includes stories on our work in #melioidoisis, #tuberculosis and the latest stage of the Aboriginal Birth Cohort Study. https://t.co/O3VC0gUJMF","TweetDeck",220,,,,FALSE,FALSE,2,2,,,"melioidoisis tuberculosis",,"bit.ly/2RZ8FFr","https://t.co/O3VC0gUJMF","https://bit.ly/2RZ8FFr",,,,,,,,,,,"en",,,,,,,,,,,,,,,,,,,,,,,,,,,,,,,,,,,,,"NA NA","NA NA","NA NA NA NA NA NA NA NA","https://twitter.com/MenziesResearch/status/1206763901691424769","Menzies Research","Darwin, Northern Territory","Menzies is the nation's leader in Indigenous and tropical health research.","http://t.co/zLh1T2hHHX",FALSE,4311,1505,103,5073,4056,2010-04-01 01:47:52,FALSE,"http://t.co/zLh1T2hHHX","http://www.menzies.edu.au/",,"https://pbs.twimg.com/profile_banners/128411498/1471845008","http://abs.twimg.com/images/themes/theme1/bg.png","http://pbs.twimg.com/profile_images/767599786912391168/IXDfzWP2_normal.jpg"
"x334653340","x1206709122932072449",2019-12-16 22:54:09,"wdloha","$310 million to fight #tuberculosis, which is $8 million above the fiscal year 2019 enacted level;

$770 million to combat #malaria, which is $15 million above the fiscal year 2019 enacted level;","Twitter for iPhone",195,"x1206709121539608582","x334653340","wdloha",FALSE,FALSE,0,0,,,"tuberculosis malaria",,,,,,,,,,,,,,,"en",,,,,,,,,,,,,,,,,,,,,,,,,,,,,,,"https://api.twitter.com/1.1/geo/id/01fbe706f872cb32.json","Washington","Washington, DC","city","United States","US","NA NA","NA NA","-77.119401 -76.909396 -76.909396 -77.119401 38.801826 38.801826 38.9953797 38.9953797","https://twitter.com/wdloha/status/1206709122932072449","Wubshet Loha","Washington, DC","Sr. Policy Analyst. Global Nutrition. Government Relations. @bread4theworld. Ex. @ACF_UK, @savechildrenuk. Husband. Opinions mine.",,FALSE,305,424,1,1939,4937,2011-07-13 13:09:50,FALSE,,,,,"http://abs.twimg.com/images/themes/theme1/bg.png","http://pbs.twimg.com/profile_images/1205277909423931393/OCLw1zz6_normal.jpg"
"x78733213","x1206671578274107394",2019-12-16 20:24:57,"occupknowledge","Hundreds of Chinese workers who drilled subway lines and foundations for Shenzhen infrastructure are coming down with #silicosis and lung disease #tuberculosis  https://t.co/CRyrj1hQpg","Twitter Web App",184,,,,FALSE,FALSE,0,0,,,"silicosis tuberculosis",,"washingtonpost.com/world/asia_pac…","https://t.co/CRyrj1hQpg","https://www.washingtonpost.com/world/asia_pacific/they-built-a-chinese-boomtown-it-left-them-dying-of-lung-disease-with-nowhere-to-turn/2019/12/15/4f070e54-0010-11ea-8341-cc3dce52e7de_story.html",,,,,,,,,,,"en",,,,,,,,,,,,,,,,,,,,,,,,,,,,,,,,,,,,,"NA NA","NA NA","NA NA NA NA NA NA NA NA","https://twitter.com/occupknowledge/status/1206671578274107394","OK International","San Francisco, CA","Occupational Knowledge International is a nonprofit organization working to build capacity in developing countries to protect public health and the environment.","http://t.co/prsfYh8uBb",FALSE,208393,169,562,2426,14,2009-09-30 22:59:53,FALSE,"http://t.co/prsfYh8uBb","http://WWW.OKINTERNATIONAL.ORG",,,"http://abs.twimg.com/images/themes/theme3/bg.gif","http://pbs.twimg.com/profile_images/456373729/Picture_5_normal.png"
"x1260176245","x1206665797470498818",2019-12-16 20:01:59,"GlobalDevLab","#PEERUSAID is committed to curbing the #tuberculosis epidemic in select #Asian countries. Apply NOW for the @USAID's PEER Women in Science Mentoring Program to support the next generation of women #TB scientists. Find out more here: https://t.co/bjWI2ohzA5 https://t.co/Hv8rs4uwii","Hootsuite Inc.",256,,,,FALSE,FALSE,3,2,,,"PEERUSAID tuberculosis Asian TB",,"is.gd/oWRNUp","https://t.co/bjWI2ohzA5","https://is.gd/oWRNUp","http://pbs.twimg.com/media/EL7wJenX0AIuS4e.jpg","https://t.co/Hv8rs4uwii","https://twitter.com/GlobalDevLab/status/1206665797470498818/photo/1","photo","http://pbs.twimg.com/media/EL7wJenX0AIuS4e.jpg","https://t.co/Hv8rs4uwii","https://twitter.com/GlobalDevLab/status/1206665797470498818/photo/1",,"x36683668","USAID","en",,,,,,,,,,,,,,,,,,,,,,,,,,,,,,,,,,,,,"NA NA","NA NA","NA NA NA NA NA NA NA NA","https://twitter.com/GlobalDevLab/status/1206665797470498818","GlobalDevLab","Washington, DC","The @USAID's Global Development Lab uses #innovation, technology, research, & partnership to promote pathways to self-reliance & resilience. #USAIDTransforms","https://t.co/bFcvIMGwVd",FALSE,32155,1627,933,20863,52349,2013-03-11 18:55:17,TRUE,"https://t.co/bFcvIMGwVd","http://www.usaid.gov/GlobalDevLab",,"https://pbs.twimg.com/profile_banners/1260176245/1549331831","http://abs.twimg.com/images/themes/theme1/bg.png","http://pbs.twimg.com/profile_images/734934463944232965/6ggf7Q6I_normal.jpg"
"x152866991","x1206665724510527488",2019-12-16 20:01:42,"USAIDGH","Kyrgyz President Jeenbekov recently visited the National Tuberculosis Center, seeing how USAID-supported technologies speed up #tuberculosis diagnosis. @USAID is proud to support initiatives to #EndTB in the #KyrgyzRepublic. @USAIDKG   https://t.co/QYRybJZduw https://t.co/F5R6yEy5R8","Hootsuite Inc.",259,,,,FALSE,FALSE,14,8,,,"tuberculosis EndTB KyrgyzRepublic",,"ow.ly/sfzo50xB46X","https://t.co/QYRybJZduw","http://ow.ly/sfzo50xB46X","http://pbs.twimg.com/media/EL7wFOMX0AEs8r5.jpg","https://t.co/F5R6yEy5R8","https://twitter.com/USAIDGH/status/1206665724510527488/photo/1","photo","http://pbs.twimg.com/media/EL7wFOMX0AEs8r5.jpg","https://t.co/F5R6yEy5R8","https://twitter.com/USAIDGH/status/1206665724510527488/photo/1",,"x36683668 x2846677665","USAID USAIDKG","en",,,,,,,,,,,,,,,,,,,,,,,,,,,,,,,,,,,,,"NA NA","NA NA","NA NA NA NA NA NA NA NA","https://twitter.com/USAIDGH/status/1206665724510527488","USAID Global Health","","For 58 years, @USAID has improved the health of people in developing countries around the world. Privacy policy: https://t.co/kHBeQqYc7L","https://t.co/Hfuq6R3waq",FALSE,162284,1207,1865,35895,2014,2010-06-07 02:40:45,TRUE,"https://t.co/Hfuq6R3waq","https://www.usaid.gov/global-health",,"https://pbs.twimg.com/profile_banners/152866991/1559849203","http://abs.twimg.com/images/themes/theme1/bg.png","http://pbs.twimg.com/profile_images/878275994381156357/fvf8j_9F_normal.jpg"
"x906452872828674049","x1206636432959430656",2019-12-16 18:05:18,"mammothbiosci","In our latest blog post, we interview Prof John Metcalfe from @UCSF. Prof Metcalfe describes his incredible work in tuberculosis diagnosis &amp; treatment, &amp; discusses how #CRISPR could impact TB. https://t.co/esQnXcZ7on #InfectiousDisease #Healthcare #globalhealth #Tuberculosis","Twitter Web App",283,,,,FALSE,FALSE,3,1,,,"CRISPR InfectiousDisease Healthcare globalhealth Tuberculosis",,"mammoth.bio/blog/2019/11/2…","https://t.co/esQnXcZ7on","https://mammoth.bio/blog/2019/11/20/mammoth-interviews-john-metcalfe-md-phd-mph-associate-professor-of-medicine-ucsf",,,,,,,,,"x15458277","UCSF","en",,,,,,,,,,,,,,,,,,,,,,,,,,,,,,,,,,,,,"NA NA","NA NA","NA NA NA NA NA NA NA NA","https://twitter.com/mammothbiosci/status/1206636432959430656","Mammoth Biosciences","San Francisco, CA","The CRISPR Platform for Disease Detection","https://t.co/inCnReKQ25",FALSE,1361,628,20,742,1407,2017-09-09 09:43:00,FALSE,"https://t.co/inCnReKQ25","http://mammoth.bio",,"https://pbs.twimg.com/profile_banners/906452872828674049/1570137946","http://abs.twimg.com/images/themes/theme1/bg.png","http://pbs.twimg.com/profile_images/1204094386830602240/jNi_fDRh_normal.jpg"
"x4695419437","x1206628304138182656",2019-12-16 17:33:00,"RachaelHore","New @TAGTeam_Tweets report shows global investment in #tuberculosis research increasing in 2018. Congratulations to the UK for meeting their “fair share” funding target! #UKAidWorks with some of the most exciting developments in a century @DFID_UK
https://t.co/jgcnQcE8k4 https://t.co/85roM0zQbP","Twitter Web App",271,,,,TRUE,FALSE,5,0,,,"tuberculosis UKAidWorks",,"treatmentactiongroup.org/tbrd2019 twitter.com/resultsuk/stat…","https://t.co/jgcnQcE8k4 https://t.co/85roM0zQbP","http://treatmentactiongroup.org/tbrd2019 https://twitter.com/resultsuk/status/1206547365768945671",,,,,,,,,"x167532359 x19915362","TAGTeam_Tweets DFID_UK","en","x1206547365768945671","Last week, @TAGTeam_Tweets and released a report on #TB #Research #funding 🔬🦠 Our TB team is quoted in this year’s report alongside amazing activists like @VandeveldeWim @tubercuLOLsis and @ekibuchi – so here’s a quick summary for our UK supporters ⬇️
https://t.co/mLwAoXTGUV",2019-12-16 12:11:23,"TweetDeck",5,2,"x87413491","resultsuk","RESULTS UK",5137,2612,14539,"London, England","RESULTS UK works to create the public and political will to end global poverty. Join us to help change the world! @ACTION_Tweets partner",FALSE,,,,,,,,,,,,,,,,,,,,,,"NA NA","NA NA","NA NA NA NA NA NA NA NA","https://twitter.com/RachaelHore/status/1206628304138182656","Rachael Hore","London, England","Tuberculosis Policy Advocacy Officer @resultsuk | Previously @msf_access & @gavi | Tweets are personal views.","https://t.co/I1q5mYZXX7",FALSE,237,288,4,257,100,2016-01-02 10:18:58,FALSE,"https://t.co/I1q5mYZXX7","http://www.vaccineswork.org/?s=rachael+hore",,,,"http://pbs.twimg.com/profile_images/814427727822487552/GNq90EKz_normal.jpg"
"x752900803879460864","x1206618338899746816",2019-12-16 16:53:24,"noisediver","Study: diabetes is associated with genotypically drug-resistant #tuberculosis. #PH https://t.co/6XHVUvW4C0 https://t.co/YeA6dyTuqi","Twitter Web App",106,,,,FALSE,FALSE,0,0,,,"tuberculosis PH",,"erj.ersjournals.com/content/early/…","https://t.co/6XHVUvW4C0","https://erj.ersjournals.com/content/early/2019/11/19/13993003.01891-2019.full","http://pbs.twimg.com/media/EL7E-pnWoAE41b7.jpg","https://t.co/YeA6dyTuqi","https://twitter.com/noisediver/status/1206618338899746816/photo/1","photo","http://pbs.twimg.com/media/EL7E-pnWoAE41b7.jpg","https://t.co/YeA6dyTuqi","https://twitter.com/noisediver/status/1206618338899746816/photo/1",,,,"en",,,,,,,,,,,,,,,,,,,,,,,,,,,,,,,,,,,,,"NA NA","NA NA","NA NA NA NA NA NA NA NA","https://twitter.com/noisediver/status/1206618338899746816","noisediver","London, England","I tweet about epidemiology/public health (often re: infectious/vector-borne diseases), and also about machine learning/big data and their social impacts/misuses","https://t.co/8crihFt8G2",FALSE,39,52,2,532,431,2016-07-12 16:21:54,FALSE,"https://t.co/8crihFt8G2","https://blog.noisediver.org",,"https://pbs.twimg.com/profile_banners/752900803879460864/1517326385",,"http://pbs.twimg.com/profile_images/831896597898330112/B5-IzLZN_normal.jpg"
"x752900803879460864","x1206595110391209989",2019-12-16 15:21:06,"noisediver","A Bayesian probabilistic risk model linking exposure concentrations of air pollutants with the population attributable fraction of pollution-related active #tuberculosis cases in #Taiwan. #PH #ML https://t.co/Ag8xjHRnZ4 https://t.co/L9b515HaV6","Twitter Web App",219,,,,FALSE,FALSE,0,0,,,"tuberculosis Taiwan PH ML",,"ncbi.nlm.nih.gov/pmc/articles/P…","https://t.co/Ag8xjHRnZ4","https://www.ncbi.nlm.nih.gov/pmc/articles/PMC6902850/","http://pbs.twimg.com/media/EL6v2s4X0AIN2Qx.jpg","https://t.co/L9b515HaV6","https://twitter.com/noisediver/status/1206595110391209989/photo/1","photo","http://pbs.twimg.com/media/EL6v2s4X0AIN2Qx.jpg","https://t.co/L9b515HaV6","https://twitter.com/noisediver/status/1206595110391209989/photo/1",,,,"en",,,,,,,,,,,,,,,,,,,,,,,,,,,,,,,,,,,,,"NA NA","NA NA","NA NA NA NA NA NA NA NA","https://twitter.com/noisediver/status/1206595110391209989","noisediver","London, England","I tweet about epidemiology/public health (often re: infectious/vector-borne diseases), and also about machine learning/big data and their social impacts/misuses","https://t.co/8crihFt8G2",FALSE,39,52,2,532,431,2016-07-12 16:21:54,FALSE,"https://t.co/8crihFt8G2","https://blog.noisediver.org",,"https://pbs.twimg.com/profile_banners/752900803879460864/1517326385",,"http://pbs.twimg.com/profile_images/831896597898330112/B5-IzLZN_normal.jpg"
"x3365662935","x1206605782894006272",2019-12-16 16:03:30,"surf4children","Meantime, #tuberculosis is still the first pathogenic killer of humankind https://t.co/cP3SsfFWKq","Twitter Web App",73,,,,TRUE,FALSE,0,0,,,"tuberculosis",,"twitter.com/TheEconomist/s…","https://t.co/cP3SsfFWKq","https://twitter.com/TheEconomist/status/1205548713445412864",,,,,,,,,,,"en","x1205548713445412864","Eliminating TB seemed tantalisingly within reach in the 1990s. Progress has been glacial since  https://t.co/wCVfc1gcpr",2019-12-13 18:03:05,"SocialFlow",51,44,"x5988062","TheEconomist","The Economist",24200341,121,197241,"London","News and analysis with a global perspective. Subscribe here: https://t.co/owztJzwlmm",TRUE,,,,,,,,,,,,,,,,,,,,,,"NA NA","NA NA","NA NA NA NA NA NA NA NA","https://twitter.com/surf4children/status/1206605782894006272","Danilo.Buonsenso_Surf4Children","Roma, Lazio","Pediatrician
No profit org founded by young doctors☀️surf for children with special needs ☀️surf and medical training in developing countries #righttofun","https://t.co/j2PVSjnz9L",FALSE,68,119,0,76,159,2015-07-08 10:13:36,FALSE,"https://t.co/j2PVSjnz9L","http://www.surf4children.it",,"https://pbs.twimg.com/profile_banners/3365662935/1466069585","http://abs.twimg.com/images/themes/theme1/bg.png","http://pbs.twimg.com/profile_images/618731118666366976/-i9eiMMy_normal.jpg"
"x1085179065571704832","x1206575374815113219",2019-12-16 14:02:41,"TB_DIAHProject","Looking for #tuberculosis #data visualized? Our data hub features summary and country-level graphs and charts. Use them to inform decisions to #EndTB. https://t.co/xgLNpBteXV https://t.co/UimbjGsyWd","Hootsuite Inc.",174,,,,FALSE,FALSE,3,1,,,"tuberculosis data EndTB",,"hub.tbdiah.org","https://t.co/xgLNpBteXV","https://hub.tbdiah.org/","http://pbs.twimg.com/media/EL6d6BEWwAIdcDK.jpg","https://t.co/UimbjGsyWd","https://twitter.com/TB_DIAHProject/status/1206575374815113219/photo/1","photo","http://pbs.twimg.com/media/EL6d6BEWwAIdcDK.jpg","https://t.co/UimbjGsyWd","https://twitter.com/TB_DIAHProject/status/1206575374815113219/photo/1",,,,"en",,,,,,,,,,,,,,,,,,,,,,,,,,,,,,,,,,,,,"NA NA","NA NA","NA NA NA NA NA NA NA NA","https://twitter.com/TB_DIAHProject/status/1206575374815113219","TB DIAH Project","Chapel Hill, NC","A @USAID-funded project meeting the demand for #TB information","https://t.co/niSe1CEZBx",FALSE,122,109,0,238,607,2019-01-15 14:17:05,FALSE,"https://t.co/niSe1CEZBx","http://www.tbdiah.org",,"https://pbs.twimg.com/profile_banners/1085179065571704832/1552410059","http://abs.twimg.com/images/themes/theme1/bg.png","http://pbs.twimg.com/profile_images/1092860242512220161/1IoVWzcM_normal.jpg"
"x1085179065571704832","x1205491794315808768",2019-12-13 14:16:55,"TB_DIAHProject","We hosted a global panel of #tuberculosis experts during the #UnionConf sharing how they use #data to #EndTB. Read highlights from our satellite session: https://t.co/N0YEkan3Ra https://t.co/aX8tq7Thi0","Twitter Web App",177,,,,FALSE,FALSE,4,3,,,"tuberculosis UnionConf data EndTB",,"tbdiah.org/stories/global…","https://t.co/N0YEkan3Ra","https://www.tbdiah.org/stories/global-panel-shares-tuberculosis-data-successes-and-challenges/","http://pbs.twimg.com/media/ELrEY-dXsAARO2m.jpg","https://t.co/aX8tq7Thi0","https://twitter.com/TB_DIAHProject/status/1205491794315808768/photo/1","photo","http://pbs.twimg.com/media/ELrEY-dXsAARO2m.jpg","https://t.co/aX8tq7Thi0","https://twitter.com/TB_DIAHProject/status/1205491794315808768/photo/1",,,,"en",,,,,,,,,,,,,,,,,,,,,,,,,,,,,,,,,,,,,"NA NA","NA NA","NA NA NA NA NA NA NA NA","https://twitter.com/TB_DIAHProject/status/1205491794315808768","TB DIAH Project","Chapel Hill, NC","A @USAID-funded project meeting the demand for #TB information","https://t.co/niSe1CEZBx",FALSE,122,109,0,238,607,2019-01-15 14:17:05,FALSE,"https://t.co/niSe1CEZBx","http://www.tbdiah.org",,"https://pbs.twimg.com/profile_banners/1085179065571704832/1552410059","http://abs.twimg.com/images/themes/theme1/bg.png","http://pbs.twimg.com/profile_images/1092860242512220161/1IoVWzcM_normal.jpg"
"x1085179065571704832","x1204764602094911488",2019-12-11 14:07:19,"TB_DIAHProject","Patients who spend 20% or more of their household income on #tuberculosis diagnosis and care incur catastrophic costs. Researchers in Nepal have found increasing active TB case finding is one way to reduce these costs. https://t.co/ZlEfqtaBnf #EndTB @BiratNepal @StopTB","Twitter Web App",269,,,,FALSE,FALSE,5,3,,,"tuberculosis EndTB",,"blogs.biomedcentral.com/on-health/2019…","https://t.co/ZlEfqtaBnf","http://blogs.biomedcentral.com/on-health/2019/12/10/zero-ing-in-on-eliminating-catastrophic-costs-for-tuberculosis-can-active-case-finding-help/",,,,,,,,,"x1110401464218705920 x108875099","BiratNepal StopTB","en",,,,,,,,,,,,,,,,,,,,,,,,,,,,,,,,,,,,,"NA NA","NA NA","NA NA NA NA NA NA NA NA","https://twitter.com/TB_DIAHProject/status/1204764602094911488","TB DIAH Project","Chapel Hill, NC","A @USAID-funded project meeting the demand for #TB information","https://t.co/niSe1CEZBx",FALSE,122,109,0,238,607,2019-01-15 14:17:05,FALSE,"https://t.co/niSe1CEZBx","http://www.tbdiah.org",,"https://pbs.twimg.com/profile_banners/1085179065571704832/1552410059","http://abs.twimg.com/images/themes/theme1/bg.png","http://pbs.twimg.com/profile_images/1092860242512220161/1IoVWzcM_normal.jpg"
"x1085179065571704832","x1205117172705562632",2019-12-12 13:28:18,"TB_DIAHProject",".#Tuberculosis is a daunting foe, killing 1.5 million people each year. To combat the world’s most lethal infectious disease, @USAID created the Global Accelerator to #EndTB. Learn more about what has been accomplished in the Accelerator's first year: https://t.co/EIserQobe7 https://t.co/pPtV2kqvQR","Twitter Web App",275,,,,FALSE,FALSE,1,1,,,"Tuberculosis EndTB",,"tbdiah.org/stories/accele…","https://t.co/EIserQobe7","https://www.tbdiah.org/stories/accelerator-anniversary/","http://pbs.twimg.com/media/ELlvqyrXsAAzXVc.jpg","https://t.co/pPtV2kqvQR","https://twitter.com/TB_DIAHProject/status/1205117172705562632/photo/1","photo","http://pbs.twimg.com/media/ELlvqyrXsAAzXVc.jpg","https://t.co/pPtV2kqvQR","https://twitter.com/TB_DIAHProject/status/1205117172705562632/photo/1",,"x36683668","USAID","en",,,,,,,,,,,,,,,,,,,,,,,,,,,,,,,,,,,,,"NA NA","NA NA","NA NA NA NA NA NA NA NA","https://twitter.com/TB_DIAHProject/status/1205117172705562632","TB DIAH Project","Chapel Hill, NC","A @USAID-funded project meeting the demand for #TB information","https://t.co/niSe1CEZBx",FALSE,122,109,0,238,607,2019-01-15 14:17:05,FALSE,"https://t.co/niSe1CEZBx","http://www.tbdiah.org",,"https://pbs.twimg.com/profile_banners/1085179065571704832/1552410059","http://abs.twimg.com/images/themes/theme1/bg.png","http://pbs.twimg.com/profile_images/1092860242512220161/1IoVWzcM_normal.jpg"
"x1169189306189135875","x1206575174553915393",2019-12-16 14:01:53,"franriera7","Introducing #ArtificialIntelligence to improve the efficiency of finding and assessing cases of #tuberculosis in South African miners is becoming a reality! Read more about this super exciting pilot here: https://t.co/bLUq77ntws","Twitter Web App",228,,,,FALSE,FALSE,1,0,,,"ArtificialIntelligence tuberculosis",,"link.medium.com/Z7OyfWA1s2","https://t.co/bLUq77ntws","https://link.medium.com/Z7OyfWA1s2",,,,,,,,,,,"en",,,,,,,,,,,,,,,,,,,,,,,,,,,,,,,,,,,,,"NA NA","NA NA","NA NA NA NA NA NA NA NA","https://twitter.com/franriera7/status/1206575174553915393","Francisco Riera","London","Paraguayan trying to avoid the central line in London ⛔️
International Development & Tech Innovation 🚀⭐️",,FALSE,41,115,0,74,141,2019-09-04 10:03:58,FALSE,,,,"https://pbs.twimg.com/profile_banners/1169189306189135875/1567595220",,"http://pbs.twimg.com/profile_images/1169196238660616192/M3_iFEV1_normal.jpg"
"x1080751926415949825","x1206566431858581504",2019-12-16 13:27:08,"EuphaIdc","Eurosurveillanc: Association between the pairwise genetic distance and epidemiological links for the 134 #MIRUVNTR clustered #tuberculosis cases, by #WGS pipeline https://t.co/YQEEAKpGKp

#WholeGenomeSequencing #AnalysisPipelines #TB #epidemiology https://t.co/qEA3VPsscq","IFTTT",271,,,,FALSE,FALSE,1,0,,,"MIRUVNTR tuberculosis WGS WholeGenomeSequencing AnalysisPipelines TB epidemiology",,"ow.ly/OT5950xzhtr","https://t.co/YQEEAKpGKp","http://ow.ly/OT5950xzhtr","http://pbs.twimg.com/media/EL6P2kNWsAAp4iP.png","https://t.co/qEA3VPsscq","https://twitter.com/Eurosurveillanc/status/1206559919106867205/photo/1","photo","http://pbs.twimg.com/media/EL6P2kNWsAAp4iP.png","https://t.co/qEA3VPsscq","https://twitter.com/Eurosurveillanc/status/1206559919106867205/photo/1",,,,"en",,,,,,,,,,,,,,,,,,,,,,,,,,,,,,,,,,,,,"NA NA","NA NA","NA NA NA NA NA NA NA NA","https://twitter.com/EuphaIdc/status/1206566431858581504","EUPHA-IDC section","","Official twitter account for the Infectious Diseases Control Section of @EUPHActs- managed by @epi_michael @odoneanna and @ricmexia","https://t.co/oXKT249uwU",FALSE,295,233,3,1841,59,2019-01-03 09:05:13,FALSE,"https://t.co/oXKT249uwU","https://eupha.org/infectious-diseases-control",,"https://pbs.twimg.com/profile_banners/1080751926415949825/1546507391",,"http://pbs.twimg.com/profile_images/1080756204123680768/7QHknRnv_normal.jpg"
"x1080751926415949825","x1206203787343478784",2019-12-15 13:26:07,"EuphaIdc","Eurosurveillanc: Towards standardisation: comparison of five #WholeGenomeSequencing (#WGS) #AnalysisPipelines for detection of epidemiologically linked #tuberculosis cases https://t.co/YQEEAKpGKp

#TB #epidemiology https://t.co/jM0b0V44ls","IFTTT",238,,,,FALSE,FALSE,1,1,,,"WholeGenomeSequencing WGS AnalysisPipelines tuberculosis TB epidemiology",,"ow.ly/OT5950xzhtr","https://t.co/YQEEAKpGKp","http://ow.ly/OT5950xzhtr","http://pbs.twimg.com/media/EL1GF_xWwAA30b7.jpg","https://t.co/jM0b0V44ls","https://twitter.com/Eurosurveillanc/status/1206197345207107584/photo/1","photo","http://pbs.twimg.com/media/EL1GF_xWwAA30b7.jpg","https://t.co/jM0b0V44ls","https://twitter.com/Eurosurveillanc/status/1206197345207107584/photo/1",,,,"en",,,,,,,,,,,,,,,,,,,,,,,,,,,,,,,,,,,,,"NA NA","NA NA","NA NA NA NA NA NA NA NA","https://twitter.com/EuphaIdc/status/1206203787343478784","EUPHA-IDC section","","Official twitter account for the Infectious Diseases Control Section of @EUPHActs- managed by @epi_michael @odoneanna and @ricmexia","https://t.co/oXKT249uwU",FALSE,295,233,3,1841,59,2019-01-03 09:05:13,FALSE,"https://t.co/oXKT249uwU","https://eupha.org/infectious-diseases-control",,"https://pbs.twimg.com/profile_banners/1080751926415949825/1546507391",,"http://pbs.twimg.com/profile_images/1080756204123680768/7QHknRnv_normal.jpg"
"x2548327358","x1205476246215368704",2019-12-13 13:15:08,"ADP_health",".@StopTB Partnership launches the updated Global Plan to #EndTB 2018-2022, calling for USD 2.6 bn per year for R&amp;D of new #tuberculosis diagnostic tools, new drug regimens and a new vaccine, and USD 13 bn per year for TB care &amp; prevention: https://t.co/cTUmh725a5 #SDGs https://t.co/IDdvNUiZgk","Buffer",277,,,,FALSE,FALSE,6,3,,,"EndTB tuberculosis SDGs",,"bit.ly/2YKucmP","https://t.co/cTUmh725a5","http://bit.ly/2YKucmP","http://pbs.twimg.com/media/ELq2QevWkAg5N5B.jpg","https://t.co/IDdvNUiZgk","https://twitter.com/ADP_health/status/1205476246215368704/photo/1","photo","http://pbs.twimg.com/media/ELq2QevWkAg5N5B.jpg","https://t.co/IDdvNUiZgk","https://twitter.com/ADP_health/status/1205476246215368704/photo/1",,"x108875099","StopTB","en",,,,,,,,,,,,,,,,,,,,,,,,,,,,,,,,,,,,,"NA NA","NA NA","NA NA NA NA NA NA NA NA","https://twitter.com/ADP_health/status/1205476246215368704","Access and Delivery Partnership","Bangkok, Thailand","ADP helps low- and middle-income countries ensure that people in need have access to new vaccines, diagnostics and medicines for #TB, #malaria and #NTDs.","http://t.co/BBgpagfbbM",FALSE,1185,1317,50,3173,498,2014-06-05 15:35:46,FALSE,"http://t.co/BBgpagfbbM","http://www.adphealth.org",,"https://pbs.twimg.com/profile_banners/2548327358/1556793239","http://abs.twimg.com/images/themes/theme1/bg.png","http://pbs.twimg.com/profile_images/1123051026641063936/5ajghfq-_normal.png"
"x2548327358","x1205400730305269760",2019-12-13 08:15:04,"ADP_health","Interesting Oped by @PeterASands &amp; @antozappulla on how @GlobalFund and @TRF are joining forces to help dismantle human rights barriers to access healthcare services for ending #AIDS, #tuberculosis &amp; #malaria: https://t.co/4epncEDKUO #UHCDay","Buffer",249,,,,FALSE,FALSE,0,0,,,"AIDS tuberculosis malaria UHCDay",,"tmsnrt.rs/2PFcRYr","https://t.co/4epncEDKUO","https://tmsnrt.rs/2PFcRYr",,,,,,,,,"x954996284934578176 x34910988 x34889448 x295713773","PeterASands antozappulla GlobalFund TRF","en",,,,,,,,,,,,,,,,,,,,,,,,,,,,,,,,,,,,,"NA NA","NA NA","NA NA NA NA NA NA NA NA","https://twitter.com/ADP_health/status/1205400730305269760","Access and Delivery Partnership","Bangkok, Thailand","ADP helps low- and middle-income countries ensure that people in need have access to new vaccines, diagnostics and medicines for #TB, #malaria and #NTDs.","http://t.co/BBgpagfbbM",FALSE,1185,1317,50,3173,498,2014-06-05 15:35:46,FALSE,"http://t.co/BBgpagfbbM","http://www.adphealth.org",,"https://pbs.twimg.com/profile_banners/2548327358/1556793239","http://abs.twimg.com/images/themes/theme1/bg.png","http://pbs.twimg.com/profile_images/1123051026641063936/5ajghfq-_normal.png"
