"x227429355","x1205131464804904960",2019-12-12 14:25:06,"AmeshAA","""will focus on using whole genome sequencing and social networking analysis to identify where transmission occurs between individuals with multidrug-resistant #tuberculosis"" https://t.co/mzRdXujq71","Twitter Web App",197,,,,FALSE,FALSE,1,0,,,"tuberculosis",,"imperial.ac.uk/news/194327/79…","https://t.co/mzRdXujq71","https://www.imperial.ac.uk/news/194327/795k-award-supports-african-research-partnership/?utm_source=Global+Health+NOW+Main+List&utm_campaign=38a1552197-EMAIL_CAMPAIGN_2019_12_11_01_27&utm_medium=email&utm_term=0_8d0d062dbd-38a1552197-884811",,,,,,,,,,,"en",,,,,,,,,,,,,,,,,,,,,,,,,,,,,,,,,,,,,"NA NA","NA NA","NA NA NA NA NA NA NA NA","https://twitter.com/AmeshAA/status/1205131464804904960","Amesh Adalja","Pittsburgh, Baltimore, NYC","Infectious disease MD working on pandemic policy, emerging infections, preventing bioterror + 1 of @STATnews top ""Physicians to Follow on Twitter"".","https://t.co/Pn086WWYSU",FALSE,5692,1961,201,30838,1276,2010-12-16 20:41:15,FALSE,"https://t.co/Pn086WWYSU","http://www.trackingzebra.com",,"https://pbs.twimg.com/profile_banners/227429355/1491244097","http://abs.twimg.com/images/themes/theme9/bg.gif","http://pbs.twimg.com/profile_images/2695623222/514e1bb9fd69df1db23fad16fb92fd5a_normal.png"
"x227429355","x1205092548957609992",2019-12-12 11:50:27,"AmeshAA","“#Tuberculosis testing is only being offered to the few that have been identified at the school” https://t.co/4vBiwkvpNG","Twitter for iPhone",120,,,,FALSE,FALSE,0,0,,,"Tuberculosis",,"post-gazette.com/news/education…","https://t.co/4vBiwkvpNG","https://www.post-gazette.com/news/education/2019/12/11/Allegheny-County-Health-epidemiologist-Kristen-Mertz-tuberculosis-case-Pittsburgh-school/stories/201912110111",,,,,,,,,,,"en",,,,,,,,,,,,,,,,,,,,,,,,,,,,,,,,,,,,,"NA NA","NA NA","NA NA NA NA NA NA NA NA","https://twitter.com/AmeshAA/status/1205092548957609992","Amesh Adalja","Pittsburgh, Baltimore, NYC","Infectious disease MD working on pandemic policy, emerging infections, preventing bioterror + 1 of @STATnews top ""Physicians to Follow on Twitter"".","https://t.co/Pn086WWYSU",FALSE,5692,1961,201,30838,1276,2010-12-16 20:41:15,FALSE,"https://t.co/Pn086WWYSU","http://www.trackingzebra.com",,"https://pbs.twimg.com/profile_banners/227429355/1491244097","http://abs.twimg.com/images/themes/theme9/bg.gif","http://pbs.twimg.com/profile_images/2695623222/514e1bb9fd69df1db23fad16fb92fd5a_normal.png"
"x227429355","x1204611691251748864",2019-12-11 03:59:42,"AmeshAA","Allegheny Co. Health Department confirms active #tuberculosis case in student at Pittsburgh school - WPXI https://t.co/0jbVLBNU5i","Twitter for iPhone",129,,,,FALSE,FALSE,2,2,,,"tuberculosis",,"www-wpxi-com.cdn.ampproject.org/v/s/www.wpxi.c…","https://t.co/0jbVLBNU5i","https://www-wpxi-com.cdn.ampproject.org/v/s/www.wpxi.com/amp/news/top-stories/allegheny-co-health-department-confirms-active-tuberculosis-case-in-student-at-pittsburgh-school/1017437946?amp_js_v=0.1#origin=https%3A%2F%2Fnews.google.com&prerenderSize=1&visibilityState=visible&paddingTop=0.01&history=0&p2r=0&horizontalScrolling=0&storage=1&development=0&log=0&cap=cid&csi=0&cid=1",,,,,,,,,,,"en",,,,,,,,,,,,,,,,,,,,,,,,,,,,,,,,,,,,,"NA NA","NA NA","NA NA NA NA NA NA NA NA","https://twitter.com/AmeshAA/status/1204611691251748864","Amesh Adalja","Pittsburgh, Baltimore, NYC","Infectious disease MD working on pandemic policy, emerging infections, preventing bioterror + 1 of @STATnews top ""Physicians to Follow on Twitter"".","https://t.co/Pn086WWYSU",FALSE,5692,1961,201,30838,1276,2010-12-16 20:41:15,FALSE,"https://t.co/Pn086WWYSU","http://www.trackingzebra.com",,"https://pbs.twimg.com/profile_banners/227429355/1491244097","http://abs.twimg.com/images/themes/theme9/bg.gif","http://pbs.twimg.com/profile_images/2695623222/514e1bb9fd69df1db23fad16fb92fd5a_normal.png"
"x999541151097999360","x1204331935285182464",2019-12-10 09:28:03,"sameekshajaisw1","Join us at #lungdiseases2020 and #speak on the #following #sessions #Lungcancer #Pulmonology #Respiratorydisorders #Tuberculosis #Asthma 
save #dates #October 19-20,2020 #Paris, #France

Inbox us at tuberculosis@europemeet.com","Twitter Web App",226,,,,FALSE,FALSE,0,0,,,"lungdiseases2020 speak following sessions Lungcancer Pulmonology Respiratorydisorders Tuberculosis Asthma dates October Paris France",,,,,,,,,,,,,,,"en",,,,,,,,,,,,,,,,,,,,,,,,,,,,,,,,,,,,,"NA NA","NA NA","NA NA NA NA NA NA NA NA","https://twitter.com/sameekshajaisw1/status/1204331935285182464","sameekshajaiswal","Paris, France","#Tuberculosis and #Respiratory #Diseases","https://t.co/OTQN9QdPIS",FALSE,61,624,0,51,75,2018-05-24 06:42:35,FALSE,"https://t.co/OTQN9QdPIS","https://bit.ly/36wn7ZH",,"https://pbs.twimg.com/profile_banners/999541151097999360/1575969582","http://abs.twimg.com/images/themes/theme1/bg.png","http://pbs.twimg.com/profile_images/1204329811742621696/xh5t-OH5_normal.jpg"
"x999541151097999360","x1205129520820281344",2019-12-12 14:17:22,"sameekshajaisw1","Join the event #lungdiseases2020 and #share your #knwoledge on #Lungtransplantation #Respiratorytractinfection #pulmonogy #Asthma #tuberculosis save dates #October 19,20-2020 #Paris #France
Reach us at tuberculosis@europemeet.com","Twitter Web App",229,,,,FALSE,FALSE,0,0,,,"lungdiseases2020 share knwoledge Lungtransplantation Respiratorytractinfection pulmonogy Asthma tuberculosis October Paris France",,,,,,,,,,,,,,,"en",,,,,,,,,,,,,,,,,,,,,,,,,,,,,,,,,,,,,"NA NA","NA NA","NA NA NA NA NA NA NA NA","https://twitter.com/sameekshajaisw1/status/1205129520820281344","sameekshajaiswal","Paris, France","#Tuberculosis and #Respiratory #Diseases","https://t.co/OTQN9QdPIS",FALSE,61,624,0,51,75,2018-05-24 06:42:35,FALSE,"https://t.co/OTQN9QdPIS","https://bit.ly/36wn7ZH",,"https://pbs.twimg.com/profile_banners/999541151097999360/1575969582","http://abs.twimg.com/images/themes/theme1/bg.png","http://pbs.twimg.com/profile_images/1204329811742621696/xh5t-OH5_normal.jpg"
"x562775992","x1205125660030775296",2019-12-12 14:02:02,"Novaerus","#Tuberculosis cases in Mexico have more than doubled in 2019, triggering an urgent call to the government to carry out an information campaign to stop the disease spreading. #TB bacteria spread through the air when a person with TB coughs, speaks or sings. https://t.co/nWWNCh839i https://t.co/bfXIQu5bA0","Hootsuite Inc.",280,,,,FALSE,FALSE,0,0,,,"Tuberculosis TB",,"ow.ly/YcBY50xu4tO","https://t.co/nWWNCh839i","http://ow.ly/YcBY50xu4tO","http://pbs.twimg.com/media/ELl3ZqRXUAERUes.jpg","https://t.co/bfXIQu5bA0","https://twitter.com/Novaerus/status/1205125660030775296/photo/1","photo","http://pbs.twimg.com/media/ELl3ZqRXUAERUes.jpg","https://t.co/bfXIQu5bA0","https://twitter.com/Novaerus/status/1205125660030775296/photo/1",,,,"en",,,,,,,,,,,,,,,,,,,,,,,,,,,,,,,,,,,,,"NA NA","NA NA","NA NA NA NA NA NA NA NA","https://twitter.com/Novaerus/status/1205125660030775296","Novaerus","Dublin City, Ireland","Novaerus portable air dis-infection units use patented ultra-low energy plasma technology to reduce infection by destroying pathogens in the air.","http://t.co/vb5jLGaojG",FALSE,351,473,14,1331,184,2012-04-25 10:36:10,FALSE,"http://t.co/vb5jLGaojG","http://Novaerus.com",,"https://pbs.twimg.com/profile_banners/562775992/1536584969","http://abs.twimg.com/images/themes/theme1/bg.png","http://pbs.twimg.com/profile_images/951548734025867264/so0V0kEl_normal.jpg"
"x46158711","x1205118343075770368",2019-12-12 13:32:57,"iasociety","What impact does directly observed therapy have on #tuberculosis (TB) treatment outcomes among people living with #HIV (PLHIV)? A study in @jiasociety explores TB treatment outcomes among an international cohort of PLHIV in low‐ and middle‐income countries https://t.co/xFojRzMBpU https://t.co/9opDovtl5u","Hootsuite Inc.",280,,,,FALSE,FALSE,9,6,,,"tuberculosis HIV",,"ow.ly/mlg130q1h46","https://t.co/xFojRzMBpU","http://ow.ly/mlg130q1h46","http://pbs.twimg.com/media/ELlwvxwXkAAwCZe.jpg","https://t.co/9opDovtl5u","https://twitter.com/iasociety/status/1205118343075770368/photo/1","photo","http://pbs.twimg.com/media/ELlwvxwXkAAwCZe.jpg","https://t.co/9opDovtl5u","https://twitter.com/iasociety/status/1205118343075770368/photo/1",,"x964200672","jiasociety","en",,,,,,,,,,,,,,,,,,,,,,,,,,,,,,,,,,,,,"NA NA","NA NA","NA NA NA NA NA NA NA NA","https://twitter.com/iasociety/status/1205118343075770368","Int. AIDS Society","","IAS is the world's largest independent association of HIV professionals. Together we advocate and drive urgent action to reduce the global impact of HIV.","http://t.co/dDdLxnWCzF",FALSE,23151,1890,365,9935,2890,2009-06-10 16:51:01,FALSE,"http://t.co/dDdLxnWCzF","http://www.iasociety.org",,"https://pbs.twimg.com/profile_banners/46158711/1573221192","http://abs.twimg.com/images/themes/theme1/bg.png","http://pbs.twimg.com/profile_images/1136284309755588609/t1eBm6C2_normal.png"
"x1195649976879108096","x1205117759945945089",2019-12-12 13:30:38,"DelhiRecords","#DelhiCulture #SpittingPaan or #Tobacco is a growing #issue for #DelhiHealth and #Hygiene. This leads to rise in #diseases as well, such as #tuberculosis, and certainly does not help the #SwacchBharatAbhiyan. Please stop this. #BanTobacco #CleanDelhi #StopSpitting #CleanIndia https://t.co/yFBrkavGVc","Hootsuite Inc.",276,,,,FALSE,FALSE,0,0,,,"DelhiCulture SpittingPaan Tobacco issue DelhiHealth Hygiene diseases tuberculosis SwacchBharatAbhiyan BanTobacco CleanDelhi StopSpitting CleanIndia",,,,,"http://pbs.twimg.com/media/ELlwN1FX0AAmBgO.jpg","https://t.co/yFBrkavGVc","https://twitter.com/DelhiRecords/status/1205117759945945089/photo/1","photo","http://pbs.twimg.com/media/ELlwN1FX0AAmBgO.jpg","https://t.co/yFBrkavGVc","https://twitter.com/DelhiRecords/status/1205117759945945089/photo/1",,,,"en",,,,,,,,,,,,,,,,,,,,,,,,,,,,,,,,,,,,,"NA NA","NA NA","NA NA NA NA NA NA NA NA","https://twitter.com/DelhiRecords/status/1205117759945945089","South Delhi Records","","Delhi's Own Music For The World","https://t.co/8rStYLRuut",FALSE,8,0,0,26,2,2019-11-16 10:29:14,FALSE,"https://t.co/8rStYLRuut","http://www.instagram.com/southdelhirecords",,,,"http://pbs.twimg.com/profile_images/1195650096156643333/jbR_eSv9_normal.png"
"x2565865626","x1205103987189530624",2019-12-12 12:35:54,"GlobalPHObserv","Evidence for supercoughers in an analysis of six #tuberculosis cohorts from China, Peru, The Gambia and Uganda
https://t.co/1dtl5B8Gw1","TweetCaster for iOS",134,,,,FALSE,FALSE,3,4,,,"tuberculosis",,"ingentaconnect.com/contentone/iua…","https://t.co/1dtl5B8Gw1","https://www.ingentaconnect.com/contentone/iuatld/ijtld/2019/00000023/00000012/art00011",,,,,,,,,,,"en",,,,,,,,,,,,,,,,,,,,,,,,,,,,,,,,,,,,,"NA NA","NA NA","NA NA NA NA NA NA NA NA","https://twitter.com/GlobalPHObserv/status/1205103987189530624","Global Health Observ","Baltimore MD USA","Johns Hopkins University - School of Public Health - Academic-based public health observatory - operational research and training  - Epidemiology Methods","https://t.co/GtXJ6oe47W",FALSE,2902,741,290,40727,1442,2014-06-13 20:40:04,FALSE,"https://t.co/GtXJ6oe47W","http://bit.ly/2oU5IcM",,"https://pbs.twimg.com/profile_banners/2565865626/1559767145","http://abs.twimg.com/images/themes/theme1/bg.png","http://pbs.twimg.com/profile_images/685926471077072896/FVn9MBix_normal.jpg"
"x2599562040","x1205078613546217478",2019-12-12 10:55:05,"WHOUganda","#Tuberculosis remains a public health burden among key populations like prisoners. In that regard, the @tegegny handed over a GeneXpert machine to @RebeccaKadagaUG to support #TB testing among prisoners. https://t.co/0y7HWWqGK4","Twitter for iPhone",203,,,,FALSE,FALSE,28,10,,,"Tuberculosis TB",,,,,"http://pbs.twimg.com/media/ELlMj3xWwAAtUc7.jpg","https://t.co/0y7HWWqGK4","https://twitter.com/WHOUganda/status/1205078613546217478/photo/1","photo","http://pbs.twimg.com/media/ELlMj3xWwAAtUc7.jpg http://pbs.twimg.com/media/ELlMj3yW4AI3n7_.jpg http://pbs.twimg.com/media/ELlMj3yX0AAareN.jpg http://pbs.twimg.com/media/ELlMj3yWkAERt_m.jpg","https://t.co/0y7HWWqGK4 https://t.co/0y7HWWqGK4 https://t.co/0y7HWWqGK4 https://t.co/0y7HWWqGK4","https://twitter.com/WHOUganda/status/1205078613546217478/photo/1 https://twitter.com/WHOUganda/status/1205078613546217478/photo/1 https://twitter.com/WHOUganda/status/1205078613546217478/photo/1 https://twitter.com/WHOUganda/status/1205078613546217478/photo/1",,"x35451154 x1085160008415920128","tegegny RebeccaKadagaUG","en",,,,,,,,,,,,,,,,,,,,,,,,,,,,,,,"https://api.twitter.com/1.1/geo/id/000c69ad123213a8.json","Kampala","Kampala, Uganda","admin","Uganda","UG","NA NA","NA NA","32.4166234 32.7216969 32.7216969 32.4166234 0.1648531 0.1648531 0.4136818 0.4136818","https://twitter.com/WHOUganda/status/1205078613546217478","WHO Uganda","Kampala, Uganda","Official account of the World Health Organization Uganda","https://t.co/e8jDxNgrZJ",FALSE,16871,89,98,4403,744,2014-07-02 10:13:37,TRUE,"https://t.co/e8jDxNgrZJ","http://www.afro.who.int/countries/uganda",,"https://pbs.twimg.com/profile_banners/2599562040/1571332629","http://abs.twimg.com/images/themes/theme1/bg.png","http://pbs.twimg.com/profile_images/743013668888182784/Zv88ruoc_normal.jpg"
"x758237938060824576","x1205045402497474565",2019-12-12 08:43:07,"DeepakSuvasiya","@mybmcWardMW @OfficeofUT @mybmc @PrakashJavdekar @MoHFW_INDIA @MumbaiPolice @CPMumbaiPolice It's gas colourless but has harsh smell. In the air NO2 sometimes have high concentration. It reomve Nirogen dioxide. It is easily absorbed by lungs. because so many people had suffered cough due it may be infect T.B, Asthma etc
#tuberculosis #AirPollution https://t.co/GhacoXS3uE","Twitter Web App",256,"x1204796296004952064","x758237938060824576","DeepakSuvasiya",FALSE,FALSE,0,1,,,"tuberculosis AirPollution",,,,,"http://pbs.twimg.com/media/ELkuY7XUEAAc8g4.jpg","https://t.co/GhacoXS3uE","https://twitter.com/DeepakSuvasiya/status/1205045402497474565/photo/1","photo","http://pbs.twimg.com/media/ELkuY7XUEAAc8g4.jpg http://pbs.twimg.com/media/ELkuY7WVAAADbK8.jpg http://pbs.twimg.com/media/ELkuY7WUYAAGfYC.jpg http://pbs.twimg.com/media/ELkuY7XVAAIPEro.jpg","https://t.co/GhacoXS3uE https://t.co/GhacoXS3uE https://t.co/GhacoXS3uE https://t.co/GhacoXS3uE","https://twitter.com/DeepakSuvasiya/status/1205045402497474565/photo/1 https://twitter.com/DeepakSuvasiya/status/1205045402497474565/photo/1 https://twitter.com/DeepakSuvasiya/status/1205045402497474565/photo/1 https://twitter.com/DeepakSuvasiya/status/1205045402497474565/photo/1",,"x1140643115541209088 x1144169755672113155 x1200214398 x1072993274 x2596143056 x4573405572 x4575856758","mybmcWardMW OfficeofUT mybmc PrakashJavdekar MoHFW_INDIA MumbaiPolice CPMumbaiPolice","en",,,,,,,,,,,,,,,,,,,,,,,,,,,,,,,,,,,,,"NA NA","NA NA","NA NA NA NA NA NA NA NA","https://twitter.com/DeepakSuvasiya/status/1205045402497474565","Deepak B.","","Student.",,FALSE,22,67,0,283,876,2016-07-27 09:49:46,FALSE,,,,"https://pbs.twimg.com/profile_banners/758237938060824576/1575374365",,"http://pbs.twimg.com/profile_images/1201833303281549314/vivd1kRd_normal.jpg"
"x809397187981484032","x1205042270296137730",2019-12-12 08:30:40,"TLillebaek","#Treating #MDRTB or #XDRTB ? Important Rapid Communication released from #WHO yesterday with key #changes to the #treatment of drug-resistant #tuberculosis 
Among others:
- For MDR-TB patients without previous exposure to 2nd-line…https://t.co/BtUmVX9rLm https://t.co/F09j02cQGZ","LinkedIn",278,,,,FALSE,FALSE,0,0,,,"Treating MDRTB XDRTB WHO changes treatment tuberculosis",,"lnkd.in/gdxDY5N lnkd.in/g93tV-Z","https://t.co/BtUmVX9rLm https://t.co/F09j02cQGZ","https://lnkd.in/gdxDY5N https://lnkd.in/g93tV-Z",,,,,,,,,,,"en",,,,,,,,,,,,,,,,,,,,,,,,,,,,,,,,,,,,,"NA NA","NA NA","NA NA NA NA NA NA NA NA","https://twitter.com/TLillebaek/status/1205042270296137730","Troels Lillebaek","København, Danmark","Private Twitter. Professor, Director, DMSc. International Reference Lab. of Mycobacteriology, Statens Serum Institut. Tuberculosis, mycobacteria & infections.","https://t.co/K0CXG5r3ML",FALSE,129,169,2,253,306,2016-12-15 13:58:22,FALSE,"https://t.co/K0CXG5r3ML","http://www.ssi.dk/English/RandD/Research%20Departments/Laboratory%20of%20Mycobacteriology.aspx",,"https://pbs.twimg.com/profile_banners/809397187981484032/1481811729",,"http://pbs.twimg.com/profile_images/931161007317233664/wjJuhdTW_normal.jpg"
"x125985779","x1205038911900266497",2019-12-12 08:17:19,"EDCTP","PanACEA 2:The new promising #tuberculosis drug BTZ-043 has been administered to patients for the first time in Cape Town, South Africa. The study is funded by EDCTP and the German Federal Ministry of Education and Research  https://t.co/5GHGRMD5LY @PanACEA_II @BMBF_Bund","Twitter Web App",270,,,,FALSE,FALSE,11,5,,,"tuberculosis",,"bit.ly/2EgbwBL","https://t.co/5GHGRMD5LY","https://bit.ly/2EgbwBL",,,,,,,,,"x842695104762732544 x2969727718","PanACEA_II BMBF_Bund","en",,,,,,,,,,,,,,,,,,,,,,,,,,,,,,,,,,,,,"NA NA","NA NA","NA NA NA NA NA NA NA NA","https://twitter.com/EDCTP/status/1205038911900266497","EDCTP","The Hague, the Netherlands","European-African partnership funding clinical research on poverty-related infectious diseases. Supported by the European Union under Horizon 2020. 🇪🇺","http://t.co/BWXAQOduIg",FALSE,3854,571,109,10010,424,2010-03-24 13:47:45,FALSE,"http://t.co/BWXAQOduIg","http://www.edctp.org",,"https://pbs.twimg.com/profile_banners/125985779/1516791414","http://abs.twimg.com/images/themes/theme1/bg.png","http://pbs.twimg.com/profile_images/956119314532315141/MQN1vmvG_normal.jpg"
"x551767389","x1205019601018462208",2019-12-12 07:00:35,"UnionConference","On #UHCDay a reminder: We can’t Keep the Promise of #HealthforAll w/out addressing social, economic &amp; environmental determinants of health. Without this total approach to health the fight to #EndTB is so much harder. @UN @UHC2030 @CSOs4UHC @WHO @UHC_Day #tuberculosis #lunghealth https://t.co/13opZY7X6e","Hootsuite Inc.",283,,,,FALSE,FALSE,1,0,,,"UHCDay HealthforAll EndTB tuberculosis lunghealth",,,,,"http://pbs.twimg.com/media/ELkW8O4X0AA7uvD.jpg","https://t.co/13opZY7X6e","https://twitter.com/UnionConference/status/1205019601018462208/photo/1","photo","http://pbs.twimg.com/media/ELkW8O4X0AA7uvD.jpg","https://t.co/13opZY7X6e","https://twitter.com/UnionConference/status/1205019601018462208/photo/1",,"x14159148 x3128916135 x982258742191276033 x14499829 x2788436090","UN UHC2030 CSOs4UHC WHO UHC_Day","en",,,,,,,,,,,,,,,,,,,,,,,,,,,,,,,,,,,,,"NA NA","NA NA","NA NA NA NA NA NA NA NA","https://twitter.com/UnionConference/status/1205019601018462208","The Union Conference","Seville, Spain","The 51st Union World Conference on Lung Health, 21 Oct - 24 October 2020, Seville, Spain. #UnionConf2020 #EndTB #AdvancingPrevention #lunghealth","https://t.co/dsblFKaZ7a",FALSE,4194,2879,54,4655,989,2012-04-12 08:42:22,FALSE,"https://t.co/dsblFKaZ7a","https://seville.worldlunghealth.org/",,"https://pbs.twimg.com/profile_banners/551767389/1576655951","http://abs.twimg.com/images/themes/theme12/bg.gif","http://pbs.twimg.com/profile_images/1207208667440910336/tqig7322_normal.png"
"x365941621","x1205015705743175686",2019-12-12 06:45:07,"ImperialMed","🌍 Our researchers are partnering with @unam_na to tackle drug-resistant #tuberculosis as part of a new £795k @The_MRC @DFID_UK funded project. #Africa

https://t.co/5PmNUn6c5H","Hootsuite Inc.",175,,,,FALSE,FALSE,3,0,,,"tuberculosis Africa",,"imperial.ac.uk/news/194327/79…","https://t.co/5PmNUn6c5H","https://www.imperial.ac.uk/news/194327/795k-award-supports-african-research-partnership/",,,,,,,,,"x376179981 x57579512 x19915362","unam_na The_MRC DFID_UK","en",,,,,,,,,,,,,,,,,,,,,,,,,,,,,,,,,,,,,"NA NA","NA NA","NA NA NA NA NA NA NA NA","https://twitter.com/ImperialMed/status/1205015705743175686","Imperial Medicine","Imperial College London","World-class research and teaching at @imperialcollege's Faculty of Medicine. Translating scientific discovery into better health for all.","http://t.co/tRVQ8HkHQm",FALSE,14195,3850,182,9740,6914,2011-09-01 08:50:24,TRUE,"http://t.co/tRVQ8HkHQm","http://www.imperial.ac.uk/medicine",,"https://pbs.twimg.com/profile_banners/365941621/1490620868","http://abs.twimg.com/images/themes/theme15/bg.png","http://pbs.twimg.com/profile_images/1148657441942511616/cUVzf4gd_normal.jpg"
"x3224242123","x1205013923612811264",2019-12-12 06:38:02,"CastlDalmunzie","#drugdevelopment #drugdiscovery #experimentalmedicine  #lmmunology #virology #vaccinations #metagenomics #infectiousdiseases The #respiratory #microbiota: new insights into #pulmonary #tuberculosis https://t.co/k1ePqOMNaL @BMC_series https://t.co/Gzgjt1AXvF @FrontImmunol","Twitter for iPad",271,,,,FALSE,FALSE,2,0,,,"drugdevelopment drugdiscovery experimentalmedicine lmmunology virology vaccinations metagenomics infectiousdiseases respiratory microbiota pulmonary tuberculosis",,"bmcinfectdis.biomedcentral.com/articles/10.11… frontiersin.org/articles/10.33…","https://t.co/k1ePqOMNaL https://t.co/Gzgjt1AXvF","https://bmcinfectdis.biomedcentral.com/articles/10.1186/s12879-019-3712-1tuberculosis https://www.frontiersin.org/articles/10.3389/fimmu.2019.01588/full",,,,,,,,,"x162088304 x397381576","BMC_series FrontImmunol","en",,,,,,,,,,,,,,,,,,,,,,,,,,,,,,,"https://api.twitter.com/1.1/geo/id/616ba1df27270916.json","Oxford","Oxford, England","city","United Kingdom","GB","NA NA","NA NA","-1.289608 -1.1772587 -1.1772587 -1.289608 51.7122668 51.7122668 51.796305 51.796305","https://twitter.com/CastlDalmunzie/status/1205013923612811264","CastlD","Oxford,United Kingdom","""Not all those who wander are lost""#Tolkien #CityofDreamingSpires #Drugdevelopment #Scientists + #Researchers. #Science is the 1st Frontier 🎨💊💉🧬🔬📚🔎🦠🧫",,FALSE,3027,2571,281,13138,29246,2015-05-23 12:13:00,FALSE,,,,"https://pbs.twimg.com/profile_banners/3224242123/1575918302","http://abs.twimg.com/images/themes/theme1/bg.png","http://pbs.twimg.com/profile_images/771649273905635328/NYMY9-2H_normal.jpg"
"x3635872333","x1205001487354433536",2019-12-12 05:48:37,"Micro_MDPI","Automatic Detection of #Granuloma Necrosis in Pulmonary #Tuberculosis Using a Two-Phase Algorithm: 2D-TB
https://t.co/ilGG5cOqcc https://t.co/JeaFCB46rP","Twitter Web App",128,,,,FALSE,FALSE,0,1,,,"Granuloma Tuberculosis",,"doi.org/10.3390/microo…","https://t.co/ilGG5cOqcc","https://doi.org/10.3390/microorganisms7120661","http://pbs.twimg.com/media/ELkGcygUwAACQFR.jpg","https://t.co/JeaFCB46rP","https://twitter.com/Micro_MDPI/status/1205001487354433536/photo/1","photo","http://pbs.twimg.com/media/ELkGcygUwAACQFR.jpg","https://t.co/JeaFCB46rP","https://twitter.com/Micro_MDPI/status/1205001487354433536/photo/1",,,,"en",,,,,,,,,,,,,,,,,,,,,,,,,,,,,,,,,,,,,"NA NA","NA NA","NA NA NA NA NA NA NA NA","https://twitter.com/Micro_MDPI/status/1205001487354433536","Microorganisms MDPI","Basel, Switzerland","Microorganisms (ISSN 2076-2607; Indexed by #SCIE) is an #OpenAccess journal of #microbiology published quarterly by @MDPIopenaccess.","http://t.co/F66zKR1LXp",FALSE,782,1209,15,1080,818,2015-09-21 08:22:15,FALSE,"http://t.co/F66zKR1LXp","http://www.mdpi.com/journal/microorganisms",,"https://pbs.twimg.com/profile_banners/3635872333/1486693769","http://abs.twimg.com/images/themes/theme1/bg.png","http://pbs.twimg.com/profile_images/647239351630299136/v1Oi2kF4_normal.png"
"x3177502867","x1204993036083613697",2019-12-12 05:15:02,"APSRapsr","Respiratory Updates""Clinical and radiological features of #pulmonary #tuberculosis in patients with idiopathic pulmonary fibrosis""
https://t.co/iWRyslQWkO
@APSRapsr @RespirologyAPSR

#lung #respiratory #TB #Respiratorystudent #respiratorytherapist","Twitter Web Client",247,,,,FALSE,FALSE,2,1,,,"pulmonary tuberculosis lung respiratory TB Respiratorystudent respiratorytherapist",,"apsresp.org/publications/r…","https://t.co/iWRyslQWkO","http://www.apsresp.org/publications/resp-updates.html",,,,,,,,,"x3177502867 x867483486","APSRapsr RespirologyAPSR","en",,,,,,,,,,,,,,,,,,,,,,,,,,,,,,,,,,,,,"NA NA","NA NA","NA NA NA NA NA NA NA NA","https://twitter.com/APSRapsr/status/1204993036083613697","Asian Pacific Society of Respirology","Website","Official twitter account of the Asian Pacific Society of Respirology","https://t.co/feTLktZ3PP",FALSE,918,203,13,2679,1322,2015-04-27 05:43:53,FALSE,"https://t.co/feTLktZ3PP","http://www.apsresp.org/",,"https://pbs.twimg.com/profile_banners/3177502867/1576134277","http://abs.twimg.com/images/themes/theme1/bg.png","http://pbs.twimg.com/profile_images/629821242212794368/97vWmvUt_normal.jpg"
